,name
1302,Reality Shares Divcon Dividend Defender
1303,Volshares Large Cap
1304,Point Bridge GOP Stock Tracker
1305,Portfolio+ Developed Markets
1306,Innovation Shares NextGen Vehicles and Technology
1307,Virtus Newfleet Dynamic Credit
1308,Sit Rising Rate
1309,Validea Market Legends
1310,Portfolio+ Emerging Markets
1311,Virtus Glovista EM
1312,Reinhart Intermediate Bond NextShares
1313,Pacer Trendpilot 750
1314,Pacer Trendpilot 450
1315,Pacer Trendpilot 100
1316,Pacer Benchmark Data & Infrastructure Real Estate
1317,Pacer US Cash Cows 100
1318,Pacer CFRA-Stovall Equal Weight Seasonal Rotation
1319,Pacer Benchmark Industrial Real Estate SCTR
1320,Pacer Trendpilot European
1321,Pacer Trendpilot International
1322,Pacer Trendpilot Fund of Funds
1323,Pacer US Cash Cows Growth
1324,Pacer Benchmark Retail Real Estate SCTR
1325,Pacer Military Times Best Employers
1326,Pacer Emerging Markets Cash Cows 100
1327,Pacific US Equity Income
1328,PGIM Ultra Short Bond
1329,PIMCO Enhanced Short Maturity Active Exchange-Trad
1330,PIMCO Total Return Active Exchange-Traded
1331,PIMCO 0-5 Year High Yield Corporate Bond
1332,PIMCO Low Duration Active
1333,PIMCO 1-5 Year US TIPS Exchange-Traded
1334,PIMCO 25+ Year Zero Coupon US Treasury
1335,PIMCO 15+ Year US TIPS Exchange-Traded
1336,PIMCO Intermediate Municipal Bond Active
1337,PIMCO Investment Grade Corporate Bond
1338,PIMCO RAFI Dynamic Multi-Factor EM Equity
1339,PIMCO 1-3 Year US Treasury
1340,PIMCO RAFI Dynamic Multi-Factor Intl Equity
1341,PIMCO Short Term Municipal Bond Active Exchange-Tr
1342,PIMCO Broad US TIPS Exchange-Traded
1343,PIMCO RAFI Dynamic Multi-Factor U.S. Equity
1344,Invesco QQQ Trust Series 1
1345,PowerShares Senior Loan Portfolio
1346,Powershares S&P 500 Low Volatility Portfolio
1347,PowerShares Preferred Portfolio
1348,PowerShares S&P MidCap Low Volatility Portfolio
1349,PowerShares S&P 500 High Quality
1350,PowerShares Emerging Markets Sovereign Debt
1351,PowerShares DB Optimum Yield Diversified Commodity
1352,PowerShares DB US Dollar Bullish
1353,PowerShares Dynamic Large Cap Value
1354,PowerShares DB Commodity Tracking
1355,PowerShares S&P 500 High Div Low Vol
1356,PowerShares Financial Preferred
1357,PowerShares DB Oil
1358,Invesco S and P 500 GARP
1359,PowerShares KBW Bank Portfolio
1360,PowerShares S&P SmallCap Low Volatility Portfolio
1361,PowerShares FTSE RAFI Emerging Markets
1362,PowerShares CEF Income Composite Portfolio
1363,PowerShares amental High Yield Corporate Bond Port
1364,PowerShares DWA Utilities Momentum Portfolio
1365,PowerShares DWA Momentum Portfolio
1366,PowerShares Variable Rate Preferred Portfolio
1367,PowerShares National AMT-Free Municipal Bond Portf
1368,PowerShares High Yield Equity Dividend Achievers P
1369,PowerShares DB Agriculture
1370,PowerShares S&P Intl Developed Low Volatility Port
1371,PowerShares Build America Bond Port
1372,PowerShares DWA EM Momentum
1373,PowerShares WilderHill Clean Energy
1374,Powershares S&P 500 High Beta Portfolio
1375,PowerShares DB Base Metals
1376,PowerShares S&P Emerging Markets Low Volatility
1377,PowerShares FTSE RAFI US 1000 Portfolio
1378,PowerShares DWA Financial Momentum Portfolio
1379,PowerShares Dynamic Software
1380,PowerShares International Dividend Achievers Portf
1381,PowerShares California AMT-Free Municipal Bond Por
1382,ProShares Long Online Short Stores
1383,PowerShares Variable Rate Investment Grade
1384,Invesco S and P MidCap Momentum
1385,PowerShares Aerospace & Defense
1386,PowerShares DB Precious Metals
1387,PowerShares KBW Premium Yield Equity REIT Portfoli
1388,PowerShares Water Resources
1389,BLDRS Developed Markets 100 ADR
1390,PowerShares Global Listed Private Equity
1391,PowerShares KBW High Dividend Yield Financial
1392,PowerShares DB US Dollar Bearish
1393,PowerShares DB Energy
1394,PowerShares Global Short Term High Yield Bond Port
1395,PowerShares S&P 500 BuyWrite Portfolio
1396,PowerShares DWA Consumer Staples Momentum Portfoli
1397,PowerShares S&P 500 Momentum Portfolio
1398,PowerShares FTSE RAFI US 1500 Small Mid
1399,PowerShares SP 500 ex-Rate Sensiti
1400,PowerShares KBW Property & Casualty Insurance Port
1401,PowerShares Dynamic Pharmaceuticals
1402,PowerShares S&P SmallCap Energy
1403,PowerShares DWA SmallCap Momentum Portfolio
1404,PowerShares DB Gold
1405,PowerShares S&P 500 Downside Hedged Portfolio
1406,PowerShares Russell 1000 Equal Weight Portfolio
1407,PowerShares FTSE RAFI Developed Markets ex-US
1408,PowerShares Dynamic Energy Exploration & Productio
1409,PowerShares DWA Technology Momentum Portfolio
1410,PowerShares mntl Invest Grade Corp Bond Portfolio
1411,PowerShares DWA Tactical Multi-Asset Income
1412,PowerShares Active US Real Estate
1413,PowerShares VRDO Tax-Free Weekly Portfolio
1414,PowerShares Cleantech
1415,PowerShares Dynamic Semiconductors
1416,PowerShares Dynamic Large Cap Growth
1417,PowerShares New York AMT-Free Municipal Bond Portf
1418,PowerShares Golden Dragon China Port
1419,PowerShares Nasdaq Internet
1420,DB Gold Double Long Exp 15 Feb 2038
1421,PowerShares Global Clean Energy
1422,PowerShares DWA Healthcare Momentum Portfolio
1423,PowerShares S&P Int Dev Qual Port
1424,PowerShares Dynamic Building & Construction
1425,PowerShares S&P SmallCap High Dividend Low Volatil
1426,PowerShares Global Water Portfolio
1427,PowerShares S&P SmallCap Information Technology
1428,PowerShares FTSE RAFI Developed Markets ex-US Smal
1429,PowerShares SP 500 Value Portfolio
1430,Invesco S and P SmallCap Value with Momentum
1431,PowerShares S&P SmallCap Health Care
1432,PowerShares S&P SmallCap Financials
1433,PowerShares Dynamic Oil & Gas Services
1434,PowerShares International BuyBack Achievers
1435,PowerShares Russell 1000 Low Beta Equal Weight
1436,PowerShares India Portfolio
1437,PowerShares Dynamic Biotechnology & Genome
1438,ProShares Decline of the Retail Store
1439,Invesco S and P SmallCap Momentum
1440,PowerShares DWA Consumer Cyclicals Momentum Portfo
1441,PowerShares DWA Tactical Sector Rotation Portfolio
1442,PowerShares International Corporate Bond
1443,Invesco S and P 500 Value with Momentum
1444,PowerShares Dynamic Networking
1445,PowerShares KBW Regional Banking Portfolio
1446,PowerShares FTSE International Low Beta Equal Weig
1447,PowerShares S&P SmallCap Utilities
1448,PowerShares DWA Energy Momentum Portfolio
1449,PowerShares Dynamic Food & Beverage
1450,PowerShares Dynamic Media
1451,PowerShares DWA Industrials Momentum Portfolio
1452,PowerShares PureBeta US Aggregate Bond Portfolio
1453,BLDRS Emerging Markets 50 ADR
1454,Invesco S and P MidCap Quality
1455,PowerShares Dynamic Leisure & Entertainment
1456,PowerShares S&P SmallCap Industrials
1457,PowerShares LadderRite 0-5 Year Corporate Bond
1458,PowerShares S&P SmallCap Materials
1459,PowerShares S&P EM Momentum Port
1460,Invesco S and P MidCap Value with Momentum
1461,PowerShares DB Silver
1462,PowerShares Russell Top 200 Equal Weight
1463,PowerShares DWA Basic Materials Momentum Portfolio
1464,PowerShares PureBeta MSCI USA Portfolio
1465,PowerShares Dynamic Market
1466,PowerShares DWA NASDAQ Momentum Portfolio
1467,PowerShares Dynamic Retail
1468,PowerShares S&P SmallCap Consumer Discretionary
1469,BLDRS Asia 50 ADR
1470,PowerShares S&P SmallCap Quality Portfolio
1471,PowerShares S&P International Developed High Divid
1472,PowerShares PureBeta FTSE Developed ex-North Ameri
1473,PowerShares PureBeta MSCI USA Small Cap Portfolio
1474,PowerShares S&P Int Dev Momentum Port
1475,PowerShares PureBeta FTSE EM Portfolio
1476,DB Agriculture Double Long Exp 01 Apr 2038
1477,DB Crude Oil Double Short Exp 01 Jun 2038
1478,DB Agriculture Long Exp 01 Apr 2038
1479,DB Base Metals Double Long Exp 01 Jun 2038
1480,DB Base Metals Double Short Exp 01 Jun 2038
1481,DB Base Metals Short Exp 01 Jun 2038
1482,BLDRS Europe Select ADR
1483,DB Crude Oil Long Exp 01 Jun 2038
1484,DB Commodity Double Long Exp 01 Apr 2038
1485,DB Commodity Short Exp 01 Apr 2038
1486,PowerShares DB G10 Currency Harvest
1487,DB Gold Short Exp 15 Feb 2038
1488,PowerShares PureBeta 0-5 US TIPS Portfolio
1489,PowerShares S&P SmallCap Consumer Staples
1490,DB Crude Oil Short Exp 01 Jun 2038
1491,Principal Millennials
1492,Principal EDGE Active Income
1493,Principal Shareholder Yield
1494,Principal Healthcare Innovators
1495,Principal International Multi-Factor Core
1496,Principal U.S. Large-Cap Multi-Factor Core Index
1497,Principal U.S. Small-MidCap Multi-Factor Core
1498,Procure Space
1499,ProShares UltraPro QQQ
1500,ProShares UltraPro Short QQQ
1501,ProShares Ultra VIX Short-Term Futures
1502,ProShares UltraShort S&P500
1503,ProShares UltraPro Short S&P500
1504,ProShares Short S&P500
1505,ProShares UltraShort 20+ Year Treasury
1506,ProShares UltraShort Bloomberg Crude Oil
1507,ProShares UltraPro S&P500
1508,ProShares VIX Short-Term Futures
1509,ProShares UltraShort QQQ
1510,ProShares Ultra Bloomberg Crude Oil
1511,ProShares Short QQQ
1512,ProShares Short VIX Short-Term Futures
1513,ProShares UltraPro 3x Crude Oil
1514,ProShares UltraPro Short Dow 30
1515,ProShares Short 20+ Yr Treasury
1516,ProShares Ultra S&P500
1517,ProShares UltraPro 3x Short Crude Oil
1518,ProShares UltraShort Russell2000
1519,ProShares Ultra Bloomberg Natural Gas
1520,ProShares UltraShort Dow30
1521,ProShares Ultra QQQ
1522,ProShares UltraPro Short Russell2000
1523,ProShares UltraPro Dow30
1524,ProShares Short Dow30
1525,ProShares Short Russell2000
1526,ProShares Ultra Dow30
1527,ProShares Ultra Silver
1528,ProShares S&P 500 Dividend Aristocrats
1529,ProShares UltraPro Russell2000
1530,ProShares Ultra Oil & Gas
1531,ProShares Ultra Russell2000
1532,ProShares UltraShort MSCI Brazil Capped
1533,ProShares Ultra Nasdaq Biotechnology
1534,ProShares Short MSCI Emerging Markets
1535,ProShares Russell 2000 Dividend Gro
1536,ProShares Ultra Gold
1537,ProShares UltraShort Bloomberg Natural Gas
1538,ProShares UltraPro Short 20+ Year Treasury
1539,ProShares UltraShort Silver
1540,ProShares Ultra MidCap400
1541,ProShares UltraShort Gold
1542,ProShares Short High Yield
1543,ProShares Ultra Financials
1544,ProShares Ultra Semiconductors
1545,ProShares Ultra Technology
1546,ProShares Ultra Real Estate
1547,ProShares UltraShort Oil and Gas
1548,ProShares VIX Mid Term Futures
1549,ProShares SP MidCap 400 Dividend
1550,ProShares Large Cap Core Plus
1551,ProShares UltraShort Nasdaq Biotechnology
1552,ProShares Investment Grade-Interest Rate Hedged
1553,ProShares UltraShort FTSE China 50
1554,ProShares UltraShort Euro
1555,ProShares Ultra Basic Materials
1556,ProShares UltraShort Real Estate
1557,Proshares UltraPro NASDAQ Biotechnology
1558,ProShares Ultra FTSE Europe
1559,ProShares UltraPro Short Financial Select Sector
1560,ProShares MSCI EAFE Dividend Growers
1561,ProShares Ultra Utilities
1562,ProShares UltraShort Industrials
1563,ProShares UltraShort Financials
1564,ProShares UltraShort MSCI Emerging Markets
1565,ProShares K-1 Free Crude Oil Strategy
1566,ProShares UltraShort Technology
1567,ProShares Online Retail
1568,ProShares Ultra FTSE China 50
1569,ProShares UltraPro Short MidCap400
1570,ProShares UltraShort MidCap400
1571,ProShares UltraShort Basic Materials
1572,ProShares S&P 500 Bond
1573,ProShares UltraPro Financial Select Sector
1574,ProShares Ultra Euro
1575,ProShares UltraShort Utilities
1576,ProShares UltraShort 7-10 Year Treasury
1577,ProShares Ultra Health Care
1578,ProShares DJ Brookfield Global Infr
1579,ProShares Short MSCI EAFE
1580,ProShares UltraShort Yen
1581,ProShares Short Financials
1582,ProShares Hedge Replication
1583,ProShares Short FTSE China 50
1584,ProShares Ultra 20+ Year Treasury
1585,ProShares UltraShort Semiconductors
1586,ProShares Ultra 7-10 Year Treasury
1587,ProShares Short Real Estate
1588,ProShares Inflation Expectations
1589,ProShares UltraShort FTSE Europe
1590,ProShares Pet Care
1591,ProShares High Yield Interest Rate
1592,ProShares Ultra MSCI Emerging Markets
1593,ProShares UltraShort MSCI Japan
1594,ProShares Ultra Yen
1595,ProShares Ultra MSCI Brazil Capped
1596,ProShares UltraPro Short NASDAQ Biotechnology
1597,ProShares Ultra Industrials
1598,ProShares Ultra MSCI EAFE
1599,ProShares Short Oil & Gas
1600,ProShares MSCI EM Dividend Growers
1601,ProShares UltraPro MidCap400
1602,ProShares Short 7-10 Year Treasury
1603,ProShares MSCI Europe Dividend Growers
1604,ProShares Short MidCap400
1605,ProShares UltraShort Consumer Goods
1606,ProShares Ultra Consumer Services
1607,ProShares Global Listed Private Equity
1608,ProShares UltraShort SmallCap600
1609,ProShares UltraShort Health Care
1610,ProShares UltraShort MSCI EAFE
1611,ProShares Ultra MSCI Japan
1612,ProShares Ultra Consumer Goods
1613,ProShares UltraShort Consumer Services
1614,ProShares SP 500 ex Health Care
1615,ProShares Short SmallCap600
1616,ProShares Morningstar Alternatives Solution
1617,ProShares SP 500 ex Technology
1618,ProShares Equities for Rising Rates
1619,ProShares S&P 500 ex Energy
1620,ProShares Ultra SmallCap600
1621,ProShares SP 500 ex Financials
1622,ProShares Merger
1623,ProShares Short Basic Materials
1624,ProShares Managed Futures Strategy
1625,ProShares Short Term USD EM Bond
1626,ProShares UltraPro Short Communication Services Se
1627,ProShares Ultra Communication Services Select Sect
1628,ProShares Short Euro
1629,ProShares UltraShort Communication Services Select
1630,ProShares Ultra Telecommunications
1631,ProShares RAFI Long/Short
1632,ProShares Ultra High Yield
1633,ProShares UltraShort Australian Dollar
1634,ProShares UltraPro Communication Services Select S
1635,PureFunds ISE Junior Silver
1636,PureFunds ISE Mobile Payments
1637,PureFunds ISE Cyber Security
1638,PureFunds Video Game Tech
1639,PureFunds Drone Economy Strategy
1640,QuantShares US Market Neutral Anti-Beta
1641,QuantShares Hedged Dividend Income
1642,QuantShares US Market Neutral Momentum
1643,QuantShares US Market Neutral Value
1644,QuantShares US Market Neutral Size
1645,RBC Quant US Dividend Leaders USD
1646,Reality Shares Fundstrat DQM Long
1647,Reality Shares Nasdaq NexGen Economy China
1648,Horizons NASDAQ 100 Covered Call
1649,LeaderShares AlphaFactor US Core
1650,Renaissance IPO
1651,Renaissance International IPO
1652,RiverFront Dynamic Core Income
1653,RiverFront Dynamic US Dividend Advantage
1654,RiverFront Dynamic US Flex-Cap
1655,RiverFront Dynamic Unconstrained Income
1656,ROBO Global Healthcare Technology & Innovation
1657,Roundhill BITKRAFT Esports & Digital Entertainment
1658,RYZZ Managed Futures Strategy Plus
1659,Salt Low truBeta US Market
1660,Satrix MSCI EM Feeder
1661,Satrix Nasdaq 100 Feeder Portfolio
1662,Satrix MSCI World Feeder
1663,Schwab International Equity
1664,Schwab US Large-Cap
1665,Schwab Emerging Markets Equity
1666,Schwab Short Term US Treasury
1667,Schwab US Broad Market
1668,Schwab US Dividend Equity
1669,Charles Schwab US REIT
1670,Schwab US Aggregate Bond
1671,Schwab Intermediate Term US Treasury
1672,Schwab US Small-Cap
1673,Schwab amental US Large Company
1674,Schwab amental Intl Large Company
1675,Schwab US Mid-Cap
1676,Schwab US TIPS
1677,Schwab US Large-Cap Value
1678,Schwab amental EM Large Company
1679,Schwab US Large-Cap Growth
1680,Schwab amental US Small Company
1681,Schwab International Small-Cap Equity
1682,Schwab amental Intl Small Company
1683,Schwab amental US Broad Market
1684,SoFi Select 500
1685,SoFi 50
1686,SoFi Next 500
1687,SoFi Gig Economy
1688,SPDR S&P 500
1689,SPDR S&P Oil & Gas Exploration & Production
1690,Financial Select Sector SPDR
1691,Utilities Select Sector SPDR
1692,Energy Select Sector SPDR
1693,Consumer Staples Select Sector SPDR
1694,Industrial Select Sector SPDR
1695,Health Care Select Sector SPDR
1696,SPDR Gold Shares
1697,Technology Select Sector SPDR
1698,SPDR Barclays High Yield Bond
1699,SPDR S&P Regional Banking
1700,Real Estate Select Sector SPDR
1701,SPDR S&P 500 Value
1702,SPDR S&P Retail
1703,Materials Select Sector SPDR
1704,SPDR Barclays Short Term High Yield Bond
1705,SPDR S&P 400 Mid Cap Value
1706,SPDR S&P Biotech
1707,SPDR S&P Metals & Mining
1708,Consumer Discretionary Select Sector SPDR
1709,SPDR S&P Bank
1710,Communication Services Select Sector SPDR
1711,SPDR S&P Homebuilders
1712,SPDR DJIA
1713,SPDR Barclays Aggregate Bond
1714,SPDR Euro Stoxx 50
1715,SPDR Barclays Invest Grade Floating Rate
1716,SPDR Barclays 1-3 Month T-Bill
1717,SPDR Barclays Long Term Treasury
1718,SPDR Gold MiniShares
1719,SPDR S&P World ex US
1720,SPDR S&P MidCap 400
1721,SPDR S&P Oil & Gas Equipment & Services
1722,SPDR Barclays Short Term Corporate Bond
1723,SPDR Barclays Intermediate Term Corporate Bond
1724,SPDR MSCI ACWI ex-US
1725,SPDR Russell 1000
1726,SPDR S&P 500 Growth
1727,SPDR Barclays Convertible Securities
1728,SPDR Barclays Short Term Treasury
1729,SPDR Blackstone/GSO Senior Loan
1730,SPDR S&P Dividend
1731,SPDR S&P 500 High Dividend
1732,SPDR S&P Emerging Markets
1733,SPDR Barclays Emerging Markets Local Bond
1734,SPDR Russell 3000
1735,SPDR DoubleLine Total Return Tactic
1736,SPDR S&P 600 Small Cap
1737,SPDR Portfolio MSCI Global
1738,SPDR Russell 2000
1739,SPDR Dow Jones International Real Estate
1740,SPDR Barclays Long Term Corporate Bond
1741,SPDR Wells Fargo Preferred Stock
1742,SPDR Russell Small Cap Completeness
1743,SPDR Portfolio Mortgage Backed Bond
1744,SPDR Barclays International Treasury Bond
1745,SPDR Nuveen Barclays Short Term Municipal Bond
1746,SPDR Nuveen Barclays Municipal Bond
1747,SPDR S&P China
1748,SPDR S&P Global Natural Resources
1749,SPDR Portfolio Intermediate Term Treasury
1750,SPDR Russell 1000 Low Volatility
1751,SPDR S&P Insurance
1752,SPDR Portfolio TIPS
1753,SPDR S&P 600 Small Cap Value
1754,SPDR S&P Transportation
1755,SPDR S&P 600 Small Cap Growth
1756,SPDR Dow Jones REIT
1757,SPDR S&P 400 Mid Cap Growth
1758,SPDR S&P Emerging Asia Pacific
1759,SPDR Nuveen S&P High Yield Municipal Bond
1760,SPDR Dow Jones Global Real Estate
1761,SPDR S&P Emerging Markets Small Cap
1762,SPDR S&P Aerospace & Defense
1763,SPDR S&P Semiconductor
1764,SPDR S&P International Dividend
1765,SPDR MSCI USA StrategicFactors
1766,SPDR S&P Pharmaceuticals
1767,SPDR SSgA Ultra Short Term Bond
1768,SPDR S&P International Small Cap
1769,SPDR Russell 2000 Low Volatility
1770,SPDR Russell 1000 Low Volatility
1771,SPDR Dorsey Wright Fixed Income Allocation
1772,SPDR Portfolio High Yield Bond
1773,SPDR S&P Emerging Markets Dividend
1774,SPDR Morgan Stanley Technology
1775,SPDR Barclays Short Term Intl Treasury Bond
1776,SPDR S&P Health Care Services
1777,SPDR S&P North American Natural Resources
1778,SPDR SSgA Income Allocation
1779,SPDR S&P Health Care Equipment
1780,SPDR Barclays 1-10 Year TIPS
1781,SPDR Barclays International Corporate Bond
1782,SPDR S&P Software & Services
1783,SPDR MFS Systematic Core Equity
1784,SPDR DoubleLine EM Fixed Income
1785,SPDR S&P Global Dividend
1786,SPDR MSCI EAFE StrategicFactors
1787,SPDR S&P 500 Fossil Fuel Reserves Free
1788,SPDR DoubleLine Short Term TR Tactical
1789,SPDR S&P Global Infrastructure
1790,SPDR SSgA Multi-Asset Real Return
1791,SPDR SSgA Global Allocation
1792,SPDR Citi International Government Inflation-Prote
1793,SPDR Portfolio Corporate Bond
1794,SPDR MSCI EAFE Fossil Fuel Reserves Free
1795,SPDR SSGA US Sector Rotation
1796,SPDR FactSet Innovative Technology
1797,SPDR MSCI Emer Mkts StrategicFactors
1798,SPDR Portfolio Europe
1799,SPDR S&P Internet
1800,SPDR SSGA Gender Diversity
1801,SPDR S&P Telecom
1802,SPDR SSGA Fixed Income Sector Rotation
1803,SPDR S&P Kensho Future Security
1804,SPDR S&P 1500 Momentum Tilt
1805,SPDR MSCI World StrategicFactors
1806,SPDR MFS Systematic Growth Equity
1807,SPDR S&P Capital Markets
1808,SPDR Russell 1000 Momentum
1809,SPDR S&P Technology Hardware
1810,SPDR Solactive Canada
1811,SPDR Solactive Japan
1812,SPDR MSCI ACWI Low Carbon Target
1813,SPDR S&P 1500 Value Tilt
1814,SPDR Global Dow
1815,SPDR S&P Kensho Smart Mobility
1816,SPDR Russell 1000 Yield Focus
1817,SPDR SP 500 Buyback
1818,SPDR S&P Kensho Intelligent Structures
1819,SPDR MSCI EM Fossil Fuel Free
1820,SPDR Solactive United Kingdom
1821,SPDR MFS Systematic Value Equity
1822,SPDR Solactive Germany
1823,SPDR EURO STOXX Small Cap
1824,SPDR Long Dollar Gold Trust
1825,SPDR S&P U.S. Utilities Select Sector UCITS
1826,Fieldstone UVA Unconstrained Medium-Term Fixed Inc
1827,Sprott Physical Silver
1828,Sprott Physical Gold
1829,SPDR Kensho New Economies Composite
1830,SPDR S&P Kensho Final Frontiers
1831,Strategy Shares Nasdaq 7 Handl Index
1832,US Market Rotation Strategy
1833,EcoLogical Strategy
1834,CWA Income
1835,Syntax Stratified LargeCap
1836,Tactical Income
1837,Teucrium Sugar
1838,Teucrium Corn
1839,Teucrium Wheat
1840,Teucrium Soybean
1841,Teucrium Agricultural
1842,Aware Ultra-Short Duration Enhanced Income
1843,TigerShares China-U.S. Internet Titans
1844,Timothy Plan High Dividend Stock
1845,Timothy Plan US Large Cap Core
1846,Tortoise Digital Payments Infrastructure
1847,Tortoise Cloud Infrastructure
1848,Tuttle Tactical Management US Core
1849,Tuttle Tactical Management Multi St
1850,UBS E-TRACS Alerian MLP Infrastructure Exp 02 Apr
1851,UBS E-TRACS Alerian MLP
1852,UBS ETRACS 2xMonthly Leveraged Alerian MLP Infra B
1853,UBS E-TRACS Monthly Pay 2xLeveraged Mortgage REIT
1854,UBS ETRACS Monthly Pay 2X
1855,UBS ETRACS ProShares Daily 3x Long Crude
1856,ETRACS 2xMonthly Pay Leveraged Preferred Stock
1857,UBS ETRACS ProShares Daily 3x Inverse Crude
1858,ETRACS 2x Monthly Pay Leveraged US Small Cap High
1859,UBS AG ETRACS Monthly Pay 2X US Small Cap High Div
1860,UBS E-TRACS Bloomberg CMCI
1861,UBS E-TRACS 2xLeveraged Long Wells Fargo Business
1862,UBS E-TRACS Linked to the Wells Fargo Business Dev
1863,UBS ETRACS Monthly Pay 2X US High Dividend Low Vol
1864,UBS AG FI Enhanced Global High Yield
1865,UBS ETRACS Monthly Pay 2X Diversified High Income
1866,UBS ETRACS 2xMonthly Leveraged S&P MLP B
1867,UBS ETRACS Monthly Pay 2xLeveraged
1868,UBS AG FI Enhanced Large Cap Growth
1869,UBS AG ETRACS Monthly Reset 2X ISE Exclusively Hom
1870,UBS AG FI Enhanced Europe 50
1871,UBS ETRACS Bloomberg CMCI Agriculture
1872,UBS ETRACS Monthly Pay 2X Wells Fargo MLP ex Energ
1873,UBS E-TRACS linked to DBloomberg Commodity Total R
1874,UBS E-TRACS Monthly Pay 2xLeveraged S&P Dividend
1875,UBS E-TRACS Monthly Pay 2xLeveraged Dow Jones Sele
1876,UBS E-TRACS Alerian Natural Gas MLP
1877,UBS E-TRACS Bloomberg CMCI Silver
1878,UBS ETRACS S&P GSCI Crude Oil TR
1879,UBS E-TRACS Bloomberg CMCI Gold
1880,UBS E-TRACS Bloomberg CMCI Food
1881,USAA Core Intermediate-Term Bond
1882,USAA MSCI USA Small Cap Value Momentum Blend
1883,USAA MSCI USA Value Momentum Blend
1884,USAA MSCI International Value Momentum Blend
1885,USAA MSCI EM Value Momentum Blend
1886,USAA Core Short-Term Bond
1887,United States Oil
1888,United States Natural Gas
1889,United States Brent Oil
1890,USCF US 3x Short Oil Fund
1891,USCF United States 3x Oil Fund
1892,United States Commodity
1893,United States Copper
1894,United States Gasoline
1895,United States 12 Month Natural Gas
1896,United States 12 Month Oil
1897,USCF SummerHaven SHPEN
1898,USCF SummerHaven SHPEI
1899,USCF SummerHaven Dynamic Commodity Strategy No K-1
1900,ValueShares Int Quantitative Value
1901,ValueShares US Quantitative Value
1902,VanEck Vectors Gold Miners
1903,VanEck Vectors Junior Gold Miners
1904,VanEck Vectors Oil Services
1905,VanEck Vectors Russia
1906,VanEck Vectors Semiconductor
1907,VanEck Vectors JP Morgan EM Local Currency Bd
1908,VanEck Vectors Morningstar Wide Moat
1909,VanEck Vectors Vietnam
1910,VanEck Vectors Fallen Angel High Yield Bond
1911,VanEck Vectors High-Yield Municipal
1912,VanEck Pref Secs ex Finls
1913,VanEck Vectors AMT-Free Intermediate Municipal
1914,VanEck Vectors-Investment Grade Floating Rate
1915,VanEck Short High-Yield Muni
1916,VanEck Emg Mkts High Yield Bd
1917,VanEck Vectors Rare Earth/Strategic Metals
1918,VanEck Vectors Egypt
1919,VanEck Vectors Mortgage REIT Income
1920,VanEck Vectors BDC Income
1921,VanEck Vectors Pharmaceutical
1922,VanEck Vectors International High Yield Bond
1923,VanEck Vectors ChinaAMC SME-ChiNext
1924,VanEck Vectors AMT-Free Long Municipal
1925,VanEck Merk Gold Trust
1926,VanEck Vectors Emerging Markets Aggregate Bond
1927,VanEck Vectors Africa
1928,VanEck Vectors Retail
1929,VanEck Vectors CEF Municipal Income
1930,VanEck Vectors Agribusiness
1931,VanEck Vectors Video Gaming and eSports
1932,VanEck Vectors Biotech
1933,VanEck Vectors Indonesia
1934,VanEck Vectors India Small-Cap
1935,VanEck Vectors Coal
1936,VanEck Vectors AMT-Free Short Municipal
1937,VanEck Vectors Steel
1938,VanEck Vectors Unconventional Oil & Gas
1939,VanEck Vectors Brazil Small-Cap
1940,VanEck Vectors High Income MLP
1941,VanEck Vectors Morningstar International Moat
1942,VanEck Vectors NDR CMG Long Flat Allocation
1943,VanEck Vectors Oil Refiners
1944,VanEck Vectors ChinaAMC A-Share
1945,VanEck Vectors Natural Resources
1946,VanEck Vectors Morningstar Global Wide Moat
1947,VanEck Vectors Gaming
1948,VanEck Vectors Real Asset Allocation
1949,VanEck Vectors Low Carbon Energy
1950,VanEck Vectors Green Bond
1951,VanEck Vectors Uranium+Nuclear Energy
1952,VanEck Vectors Morningstar Durable Dividend
1953,Morgan Stanley Market Vectors 2X Euro
1954,VanEck Vectors Municipal Allocation
1955,VanEck Vectors Russia Small-Cap
1956,VanEck Vectors ChinaAMC China Bond
1957,VanEck Vectors Israel
